[
  {
    "id": 1,
    "name": "kamranahmedse/developer-roadmap",
    "url": "https://github.com/kamranahmedse/developer-roadmap",
    "category": "yol-haritalari",
    "tags": [
      "roadmap",
      "kariyer",
      "müfredat",
      "rehber"
    ],
    "type": "reference",
    "priority": "high",
    "when_to_use": "Hangi frontend teknolojisine öncelik verileceği, hangi aracın ne zaman öğrenileceği sorulduğunda.",
    "how_to_use": "README.md'deki frontend diyagramını incele, güncel yılın önerilerini oku.",
    "related": [
      2
    ],
    "alternatives": [],
    "install_command": null,
    "peer_dependencies": [],
    "lifecycle": "active",
    "scores": {
      "ssr_compat": 5,
      "rsc_compat": 5,
      "bundle_cost": 10,
      "typescript": 5,
      "maintenance": 7,
      "learning_curve": 7,
      "community": 7
    }
  },
  {
    "id": 2,
    "name": "mdn/content",
    "url": "https://github.com/mdn/content",
    "category": "yol-haritalari",
    "tags": [
      "mdn",
      "web-standartlari",
      "html",
      "css",
      "javascript",
      "api"
    ],
    "type": "reference",
    "priority": "high",
    "when_to_use": "HTML, CSS, JavaScript ve Web API'lerinin derinlemesine referansı gerektiğinde.",
    "how_to_use": "files/en-us/ altındaki dokümanları oku, ilgili API'nin kullanım örneğini bul.",
    "related": [
      1,
      3
    ],
    "alternatives": [],
    "install_command": null,
    "peer_dependencies": [],
    "lifecycle": "active",
    "scores": {
      "ssr_compat": 5,
      "rsc_compat": 5,
      "bundle_cost": 10,
      "typescript": 5,
      "maintenance": 7,
      "learning_curve": 7,
      "community": 7
    }
  },
  {
    "id": 3,
    "name": "html5boilerplate/html5-boilerplate",
    "url": "https://github.com/h5bp/html5-boilerplate",
    "category": "yol-haritalari",
    "tags": [
      "html5",
      "baslangic",
      "sablon",
      "performans",
      "seo"
    ],
    "type": "template",
    "priority": "medium",
    "when_to_use": "Sıfırdan profesyonel bir HTML/CSS projesi başlatırken, temel best practice'leri garantilemek için.",
    "how_to_use": "dist/ klasöründeki yapıyı incele, .htaccess ve index.html yapılandırmalarını kopyala.",
    "related": [
      2,
      16
    ],
    "alternatives": [],
    "install_command": null,
    "peer_dependencies": [],
    "lifecycle": "active",
    "scores": {
      "ssr_compat": 6,
      "rsc_compat": 6,
      "bundle_cost": 8,
      "typescript": 6,
      "maintenance": 6,
      "learning_curve": 7,
      "community": 6
    }
  },
  {
    "id": 4,
    "name": "trekhleb/javascript-algorithms",
    "url": "https://github.com/trekhleb/javascript-algorithms",
    "category": "yol-haritalari",
    "tags": [
      "algoritma",
      "veri-yapilari",
      "javascript",
      "mulakat"
    ],
    "type": "reference",
    "priority": "medium",
    "when_to_use": "Performans optimizasyonu gerektiren algoritmik frontend problemlerinde veya işe alım mülakatlarında.",
    "how_to_use": "src/algorithms/ altındaki her klasörü incele, README'deki açıklamayı ve test dosyasını oku.",
    "related": [
      1
    ],
    "alternatives": [],
    "install_command": null,
    "peer_dependencies": [],
    "lifecycle": "active",
    "scores": {
      "ssr_compat": 5,
      "rsc_compat": 5,
      "bundle_cost": 10,
      "typescript": 5,
      "maintenance": 7,
      "learning_curve": 7,
      "community": 7
    }
  },
  {
    "id": 5,
    "name": "greensock/GSAP",
    "url": "https://github.com/greensock/GSAP",
    "category": "animasyonlar",
    "tags": [
      "animation",
      "timeline",
      "scrolltrigger",
      "high-performance",
      "svg"
    ],
    "type": "library",
    "priority": "high",
    "when_to_use": "Karmaşık timeline animasyonları, scroll-trigger'lı sahneler, SVG morphing, yüksek performanslı sürekli animasyonlar gerektiğinde.",
    "how_to_use": "src/ dizinindeki plugin'leri incele. Özellikle ScrollTrigger ve Timeline örneklerine bak.",
    "related": [
      6,
      9,
      28,
      47,
      195
    ],
    "alternatives": [
      6,
      11,
      21
    ],
    "install_command": "npm install gsap",
    "peer_dependencies": [],
    "lifecycle": "active",
    "scores": {
      "ssr_compat": 7,
      "rsc_compat": 6,
      "bundle_cost": 6,
      "typescript": 7,
      "maintenance": 7,
      "learning_curve": 6,
      "community": 7
    },
    "bundle_kb_gzip": 27
  },
  {
    "id": 6,
    "name": "framer/motion",
    "url": "https://github.com/framer/motion",
    "category": "animasyonlar",
    "tags": [
      "react",
      "animation",
      "layout",
      "gesture",
      "declarative"
    ],
    "type": "library",
    "priority": "high",
    "when_to_use": "React projelerinde deklaratif animasyonlar, layout geçişleri, hover/tap gesture'ları gerektiğinde.",
    "how_to_use": "packages/framer-motion/README.md ve examples/ klasöründen AnimatePresence, layoutId örneklerini incele.",
    "related": [
      5,
      22,
      35,
      37
    ],
    "alternatives": [
      5,
      22
    ],
    "install_command": "npm install framer-motion",
    "peer_dependencies": [
      "react",
      "react-dom"
    ],
    "lifecycle": "active",
    "scores": {
      "ssr_compat": 7,
      "rsc_compat": 6,
      "bundle_cost": 5,
      "typescript": 7,
      "maintenance": 7,
      "learning_curve": 6,
      "community": 7
    },
    "bundle_kb_gzip": 43
  },
  {
    "id": 7,
    "name": "airbnb/lottie-web",
    "url": "https://github.com/airbnb/lottie-web",
    "category": "animasyonlar",
    "tags": [
      "lottie",
      "after-effects",
      "json",
      "vektor",
      "bodymovin"
    ],
    "type": "library",
    "priority": "medium",
    "when_to_use": "Tasarımcıların After Effects'te hazırladığı vektörel animasyonları web'de kayıpsız oynatmak gerektiğinde.",
    "how_to_use": "README'deki API dokümanından loadAnimation() metodunu incele, JSON format gereksinimlerine bak.",
    "related": [
      5
    ],
    "alternatives": [],
    "install_command": "npm install lottie-web",
    "peer_dependencies": [],
    "lifecycle": "active",
    "scores": {
      "ssr_compat": 7,
      "rsc_compat": 6,
      "bundle_cost": 5,
      "typescript": 7,
      "maintenance": 7,
      "learning_curve": 6,
      "community": 7
    },
    "bundle_kb_gzip": 62
  },
  {
    "id": 8,
    "name": "animate-css/animate.css",
    "url": "https://github.com/animate-css/animate.css",
    "category": "animasyonlar",
    "tags": [
      "css",
      "hazir-animasyon",
      "tak-calistir",
      "attention-seekers"
    ],
    "type": "library",
    "priority": "low",
    "when_to_use": "Hızlı prototiplemede veya basit giriş/çıkış animasyonları için, JavaScript animasyon kütüphanesi kurmadan önce.",
    "how_to_use": "docs/ sayfasındaki sınıf isimlerini ve örnekleri incele. animate__animated animate__bounce gibi.",
    "related": [
      23
    ],
    "alternatives": [],
    "install_command": "npm install animate.css",
    "peer_dependencies": [],
    "lifecycle": "active",
    "scores": {
      "ssr_compat": 7,
      "rsc_compat": 6,
      "bundle_cost": 6,
      "typescript": 7,
      "maintenance": 7,
      "learning_curve": 6,
      "community": 7
    }
  },
  {
    "id": 9,
    "name": "locomotivemtl/locomotive-scroll",
    "url": "https://github.com/locomotivemtl/locomotive-scroll",
    "category": "animasyonlar",
    "tags": [
      "scroll",
      "smooth-scroll",
      "parallax",
      "lerp"
    ],
    "type": "library",
    "priority": "medium",
    "when_to_use": "Ödüllü Awwwards sitelerindeki gibi akıcı, sinematik scroll deneyimi ve parallax efektleri gerektiğinde.",
    "how_to_use": "README'deki data-attribute kurulumunu incele. data-scroll-container, data-scroll-speed kullanımını öğren.",
    "related": [
      5,
      28,
      32
    ],
    "alternatives": [
      28
    ],
    "install_command": "npm install locomotive-scroll",
    "peer_dependencies": [],
    "lifecycle": "active",
    "scores": {
      "ssr_compat": 7,
      "rsc_compat": 6,
      "bundle_cost": 6,
      "typescript": 7,
      "maintenance": 7,
      "learning_curve": 6,
      "community": 7
    },
    "bundle_kb_gzip": 21
  },
  {
    "id": 10,
    "name": "jlmakes/scrollreveal",
    "url": "https://github.com/jlmakes/scrollreveal",
    "category": "animasyonlar",
    "tags": [
      "scroll",
      "reveal",
      "hafif",
      "bagimsiz"
    ],
    "type": "library",
    "priority": "medium",
    "when_to_use": "Sayfa kaydırıldıkça elementlerin sırayla belirmesi (reveal) efekti için, bağımlılıksız hafif bir çözüm gerektiğinde.",
    "how_to_use": "README'deki temel kurulumu incele. ScrollReveal().reveal() API'sini kullan.",
    "related": [
      23,
      28
    ],
    "alternatives": [
      23
    ],
    "install_command": "npm install scrollreveal",
    "peer_dependencies": [],
    "lifecycle": "active",
    "scores": {
      "ssr_compat": 7,
      "rsc_compat": 6,
      "bundle_cost": 6,
      "typescript": 7,
      "maintenance": 7,
      "learning_curve": 6,
      "community": 7
    }
  },
  {
    "id": 11,
    "name": "popmotion/popmotion",
    "url": "https://github.com/popmotion/popmotion",
    "category": "animasyonlar",
    "tags": [
      "fizik",
      "spring",
      "physics",
      "low-level",
      "motor"
    ],
    "type": "library",
    "priority": "low",
    "when_to_use": "Fizik tabanlı (yaylanma, sürtünme) animasyonları kendi motorunla kontrol etmek istediğinde; Framer Motion'ın da altyapısıdır.",
    "how_to_use": "packages/popmotion/README.md ve API dokümanından animate, spring, physics fonksiyonlarını incele.",
    "related": [
      6,
      22
    ],
    "alternatives": [
      5,
      6
    ],
    "install_command": "npm install popmotion",
    "peer_dependencies": [],
    "lifecycle": "active",
    "scores": {
      "ssr_compat": 7,
      "rsc_compat": 6,
      "bundle_cost": 6,
      "typescript": 7,